{
  "contract": "content-brief", "contractVersion": "1.1.0", "briefId": "brief.rev-1-1", "revision": 1,
  "briefType": "talking_head", "channel": { "venture": "orthic", "channel": "legion-notes", "account": "main" },
  "platforms": ["youtube_shorts"], "deliverables": ["text"],
  "stages": [ { "id": "transcription", "requestId": "req.transcription.1", "inputHash": "blake3:7777777777777777777777777777777777777777777777777777777777777777", "dependsOn": [] } ]
}
